{
  "schema_version": 1,
  "artifact_kind": "pooleos_native_policy_readiness",
  "contract_id": "PPOL1",
  "status": "pass",
  "inputs": {
    "contract": {
      "path": "specs/native-policy-contract.json",
      "bytes": 9387,
      "sha256": "02A343483A7539DFCE1E8EF90B88269FD30E0DAB7EE879555159B7F5741A4F00"
    },
    "golden_vectors": {
      "path": "specs/native-policy-golden-vectors.json",
      "bytes": 43996,
      "sha256": "948C8B0C2164ADA1516B8671B818FA24CA98EEC6E275704D19ED6A95D2F623EA"
    },
    "toolchain_lock": {
      "path": "specs/native-toolchain-lock.json",
      "bytes": 4017,
      "sha256": "79084B39BC43C0B3B96ABE93328184338470A2FFFF257C6E2305215E6B2CCA4E"
    },
    "toolchain_qualification": {
      "path": "runs/native_toolchain_qualification.json",
      "bytes": 14423,
      "sha256": "87668ADC571427244CD490D172CD01BAA3871709A0D76F7319D665526B68CFB5"
    },
    "tier1_profile": {
      "path": "specs/tier1-hardware-target.json",
      "bytes": 9005,
      "sha256": "E6976539E72D32974918B2ABA7AB53043AB44AB478D8CBA0ABF9E30E66869F89"
    },
    "implementation_inputs": [
      {
        "path": "native/.cargo/config.toml",
        "bytes": 539,
        "sha256": "7983881C5CAD2B909CCA64BFA7F5895EC56377B0E52967444CB2818A69FA4FE1"
      },
      {
        "path": "native/rust-toolchain.toml",
        "bytes": 131,
        "sha256": "06C4E0BD63FE84DCB26A0FAE52D96F23C38979DBE6F154D58EAB1547F81FA26B"
      },
      {
        "path": "specs/native-toolchain-lock.json",
        "bytes": 4017,
        "sha256": "79084B39BC43C0B3B96ABE93328184338470A2FFFF257C6E2305215E6B2CCA4E"
      },
      {
        "path": "specs/native-host-msvc-profile.json",
        "bytes": 2092,
        "sha256": "4BD6B069392E11215EE1942425B3A12CE2CAEC6746A9450EAC20B037FC538182"
      },
      {
        "path": "tools/native_host_toolchain.py",
        "bytes": 5317,
        "sha256": "4AC87084B9B1F023C1FE2518858899A4A71BF90B9CA4DF3D312E342257E3099F"
      },
      {
        "path": "tools/qualify_native_toolchain.py",
        "bytes": 22364,
        "sha256": "655FCC0A572AE4FB2899840007F22A31CDCF9D114952C60F657EE3F4BF0F9C50"
      },
      {
        "path": "tests/test_native_boot_host_toolchain.py",
        "bytes": 8247,
        "sha256": "39514B13649D45BB60C2C0471F80F45D4B176C018ED7C7B9B430BC4D8DE63C02"
      },
      {
        "path": "native/Cargo.toml",
        "bytes": 601,
        "sha256": "210BCDAF2778606B42C688E7BACD950FC0EEF3045081E884CF7846B9A7D78DF4"
      },
      {
        "path": "native/Cargo.lock",
        "bytes": 4193,
        "sha256": "29CE9938C5C60DEA5AEA244A6961BB1924D88AEC601D1E02EAAA510B0B36E390"
      },
      {
        "path": "native/policy/Cargo.toml",
        "bytes": 395,
        "sha256": "938D50FAE804F0618B12F1870A9FA869BADB42A2834B8628D2283E6E38B45593"
      },
      {
        "path": "native/policy/src/lib.rs",
        "bytes": 55054,
        "sha256": "F8B0B214526ADF6867081B3E67F52ADCE47F444C0DD34BAB6EB797D18714E320"
      },
      {
        "path": "native/policy/src/bin/ppol1_probe.rs",
        "bytes": 9376,
        "sha256": "8CC8D5572A6155559E92E2ECB4154DEDEA01335F15A977C5FF30EDE8ADEF597C"
      },
      {
        "path": "runtime/native_policy.py",
        "bytes": 59322,
        "sha256": "1301C4D02F3333F1CBB72D7F0CCC37FCDE7E7AB6A7B1388F0E39B97F6C2527C4"
      },
      {
        "path": "runtime/native_boot_artifact.py",
        "bytes": 8217,
        "sha256": "518F0392D35DFDE8EB2A3971DA382E455822A7FD2344163FB65D0FCC95FC63ED"
      },
      {
        "path": "runtime/native_initial_system.py",
        "bytes": 68796,
        "sha256": "C7213D00230A8A4BC4423CA63893663ADC637ACD5BC107C6C6A2E89D43387A7E"
      },
      {
        "path": "runtime/native_recovery.py",
        "bytes": 60364,
        "sha256": "9FE923CB2A1DA1083858750FE324321ADB4CB56D9D69DC33B2DBA7D36625E95D"
      },
      {
        "path": "runtime/native_symbols.py",
        "bytes": 56515,
        "sha256": "F360441FBDBAEADAC34DA5041867A40B44A525E73AC593F73A886D00B5EAE5F8"
      },
      {
        "path": "runtime/native_microcode.py",
        "bytes": 52453,
        "sha256": "089AE566AA73BD23C9A9E648AE6F221406EB49EB9D44EF672BAE119F5D887772"
      },
      {
        "path": "runtime/native_firmware.py",
        "bytes": 52263,
        "sha256": "CA55F8DA2D3FE585FB35D9E10E576B5B7FC8F132A752EAE92CFDE0521A63EDFC"
      },
      {
        "path": "tools/generate_native_policy_vectors.py",
        "bytes": 2087,
        "sha256": "2C43457AF5C7D4B0B8A1D157717AC668955D00DF9637E43ACCC3D9494E7A05E2"
      },
      {
        "path": "tools/qualify_native_policy.py",
        "bytes": 34945,
        "sha256": "0C42B98FEFC77EC338AFE00F61561DE801EF81949DB59E57BF89B07FE8DD5F44"
      },
      {
        "path": "tests/test_native_policy.py",
        "bytes": 7623,
        "sha256": "AB478682CFA38217722D185873FDB1DC30A7729FF5CC145664015C79A7EA8F18"
      },
      {
        "path": "docs/native-policy-bundle.md",
        "bytes": 6234,
        "sha256": "803873DAEC323313D8A266A17D69B36C99AE85522E04700964EA8F192D4CB5A0"
      }
    ]
  },
  "build": {
    "status": "pass",
    "rustc": "rustc 1.97.0 (2d8144b78 2026-07-07)",
    "host_tests": 6,
    "host_toolchain": {
      "profile_id": "POOLEOS-HOST-MSVC-1",
      "profile_sha256": "4BD6B069392E11215EE1942425B3A12CE2CAEC6746A9450EAC20B037FC538182",
      "verified_before_build": true,
      "scope": "host_linker_and_library_trees_not_complete_host_attestation"
    },
    "rustfmt_packages": 1,
    "clippy_targets": 1,
    "no_std_targets": [
      "x86_64-unknown-none",
      "x86_64-unknown-uefi"
    ]
  },
  "golden": {
    "status": "pass",
    "vectors": 3,
    "python_rust_exact": true
  },
  "negative_controls": [
    {
      "id": "NEG-N5-PPOL-PARSER-EMPTY",
      "expected": "ppol_truncated",
      "status": "pass"
    },
    {
      "id": "NEG-N5-PPOL-PARSER-TRUNCATED",
      "expected": "ppol_truncated",
      "status": "pass"
    },
    {
      "id": "NEG-N5-PPOL-PARSER-OVERSIZED",
      "expected": "ppol_oversized",
      "status": "pass"
    },
    {
      "id": "NEG-N5-PPOL-PARSER-MAGIC",
      "expected": "ppol_magic",
      "status": "pass"
    },
    {
      "id": "NEG-N5-PPOL-PARSER-MAJOR",
      "expected": "ppol_version",
      "status": "pass"
    },
    {
      "id": "NEG-N5-PPOL-PARSER-MINOR",
      "expected": "ppol_version",
      "status": "pass"
    },
    {
      "id": "NEG-N5-PPOL-PARSER-HEADER-SIZE",
      "expected": "ppol_record_size",
      "status": "pass"
    },
    {
      "id": "NEG-N5-PPOL-PARSER-MODE-RECORD-SIZE",
      "expected": "ppol_record_size",
      "status": "pass"
    },
    {
      "id": "NEG-N5-PPOL-PARSER-CAP-RECORD-SIZE",
      "expected": "ppol_record_size",
      "status": "pass"
    },
    {
      "id": "NEG-N5-PPOL-PARSER-PROFILE",
      "expected": "ppol_profile",
      "status": "pass"
    },
    {
      "id": "NEG-N5-PPOL-PARSER-FLAGS",
      "expected": "ppol_flags",
      "status": "pass"
    },
    {
      "id": "NEG-N5-PPOL-PARSER-POLICY-VERSION",
      "expected": "ppol_version_floor",
      "status": "pass"
    },
    {
      "id": "NEG-N5-PPOL-PARSER-SECURE-VERSION",
      "expected": "ppol_version_floor",
      "status": "pass"
    },
    {
      "id": "NEG-N5-PPOL-PARSER-ROLLBACK-FLOOR",
      "expected": "ppol_version_floor",
      "status": "pass"
    },
    {
      "id": "NEG-N5-PPOL-PARSER-MODE-COUNT",
      "expected": "ppol_counts",
      "status": "pass"
    },
    {
      "id": "NEG-N5-PPOL-PARSER-CAP-COUNT",
      "expected": "ppol_counts",
      "status": "pass"
    },
    {
      "id": "NEG-N5-PPOL-PARSER-REQUIRED-MODES",
      "expected": "ppol_required_modes",
      "status": "pass"
    },
    {
      "id": "NEG-N5-PPOL-PARSER-MODE-OFFSET",
      "expected": "ppol_table_layout",
      "status": "pass"
    },
    {
      "id": "NEG-N5-PPOL-PARSER-CAP-OFFSET",
      "expected": "ppol_table_layout",
      "status": "pass"
    },
    {
      "id": "NEG-N5-PPOL-PARSER-TRAILING",
      "expected": "ppol_trailing_bytes",
      "status": "pass"
    },
    {
      "id": "NEG-N5-PPOL-PARSER-AUDIT-LIMIT",
      "expected": "ppol_limits",
      "status": "pass"
    },
    {
      "id": "NEG-N5-PPOL-PARSER-GENERATION-ADVANCE",
      "expected": "ppol_limits",
      "status": "pass"
    },
    {
      "id": "NEG-N5-PPOL-PARSER-DEFAULT-CEILING",
      "expected": "ppol_default_ceiling",
      "status": "pass"
    },
    {
      "id": "NEG-N5-PPOL-PARSER-HEADER-RESERVED",
      "expected": "ppol_default_ceiling",
      "status": "pass"
    },
    {
      "id": "NEG-N5-PPOL-PARSER-IDENTITY-DIGEST",
      "expected": "ppol_digest",
      "status": "pass"
    },
    {
      "id": "NEG-N5-PPOL-PARSER-BODY-DIGEST",
      "expected": "ppol_body_digest",
      "status": "pass"
    },
    {
      "id": "NEG-N5-PPOL-PARSER-POLICY-ID",
      "expected": "ppol_policy_id",
      "status": "pass"
    },
    {
      "id": "NEG-N5-PPOL-PARSER-RESERVED",
      "expected": "ppol_reserved",
      "status": "pass"
    },
    {
      "id": "NEG-N5-PPOL-PARSER-MODE-ORDER",
      "expected": "ppol_mode_order",
      "status": "pass"
    },
    {
      "id": "NEG-N5-PPOL-PARSER-MODE-FLAGS",
      "expected": "ppol_mode_flags",
      "status": "pass"
    },
    {
      "id": "NEG-N5-PPOL-PARSER-MODE-RESERVED",
      "expected": "ppol_mode_reserved",
      "status": "pass"
    },
    {
      "id": "NEG-N5-PPOL-PARSER-MODE-CAP-COUNT",
      "expected": "ppol_mode_capability_count",
      "status": "pass"
    },
    {
      "id": "NEG-N5-PPOL-PARSER-MODE-EFFECTS",
      "expected": "ppol_mode_effects",
      "status": "pass"
    },
    {
      "id": "NEG-N5-PPOL-PARSER-MODE-PROHIBITED",
      "expected": "ppol_mode_prohibited_effects",
      "status": "pass"
    },
    {
      "id": "NEG-N5-PPOL-PARSER-MODE-EVIDENCE",
      "expected": "ppol_mode_evidence",
      "status": "pass"
    },
    {